{
  "schema_version": "1.0.0",
  "action_id": "act_01JBQ8Z4K7M3N9P2R5T6V8W0Z9",
  "context_id": "arbeitgeber_visolva",
  "goal": "Antwort an den Kunden zur Lieferzeit versenden",
  "description": "Individuelle Antwort auf die Rueckfrage zum Angebot 2026-0815.",
  "action_type": "mail.send",
  "origin": {
    "event_id": "evt_01JBQ8Z4K7M3N9P2R5T6V8W0Y2",
    "task_id": "tsk_01JBQ8Z4K7M3N9P2R5T6V8W0Z6",
    "trigger": "event",
    "source_refs": [
      {
        "object_type": "email",
        "object_id": "eml_01JBQ8Z4K7M3N9P2R5T6V8W0Z4",
        "context_id": "arbeitgeber_visolva"
      }
    ]
  },
  "actor": "jarvis",
  "target": {
    "system_adapter_id": "mail_m365",
    "tool_id": "mail_default.send_message",
    "tool_version": "1.0.0",
    "target_object": {
      "object_type": "email",
      "context_id": "arbeitgeber_visolva",
      "system": "mail_m365",
      "external_id": "EXTERNAL_THREAD_ID_PLACEHOLDER"
    },
    "recipients": [
      {
        "object_type": "person",
        "context_id": "arbeitgeber_visolva",
        "system": "crm_odoo",
        "external_id": "EXTERNAL_PARTNER_ID_PLACEHOLDER",
        "label": "Kundenkontakt"
      }
    ]
  },
  "inputs": {
    "subject": "Rueckmeldung zur Lieferzeit Angebot 2026-0815",
    "body_ref": "draft:internal/EXTERNAL_DRAFT_REF"
  },
  "missing_inputs": [],
  "risk_class": "C",
  "risk_rationale": "Individuelle E-Mail an einen externen Empfaenger, nicht rueckholbar.",
  "risk_class_source": "context_override",
  "reversibility": "irreversible",
  "approval_id": "apr_01JBQ8Z4K7M3N9P2R5T6V8W0ZA",
  "approval_status": "approved",
  "status": "succeeded",
  "dry_run": false,
  "priority": "high",
  "due_at": "2026-09-01T12:00:00Z",
  "idempotency_key": "2bdd3ed10d1112c53035ee519a9ef2baffaa75c0eb53ab12858ed4d2e3c05930",
  "idempotency_basis": {
    "context_id": "arbeitgeber_visolva",
    "source_ref": "evt_01JBQ8Z4K7M3N9P2R5T6V8W0Y2",
    "action_type": "mail.send",
    "target_system": "mail_m365",
    "target_object_ref": "thread:EXTERNAL_THREAD_ID_PLACEHOLDER"
  },
  "content_fingerprint": "sha256:e7f4c94a3a7f15db0d489f0cba4eb14eba9dbaf6e9ea254e1994c403cf2daaa5",
  "attempt_count": 1,
  "max_attempts": 3,
  "last_attempt_at": "2026-08-29T08:02:11Z",
  "evidence_ids": [
    "evd_01JBQ8Z4K7M3N9P2R5T6V8W0ZB"
  ],
  "error_ids": [],
  "created_at": "2026-08-29T07:12:00Z",
  "updated_at": "2026-08-29T08:02:40Z",
  "executed_at": "2026-08-29T08:02:11Z",
  "verified_at": "2026-08-29T08:02:34Z",
  "producer": {
    "producer_type": "agent",
    "producer_id": "executor",
    "producer_version": "1.0.0"
  },
  "trace": {
    "trace_id": "tr-20260829-0002",
    "correlation_id": "co-20260829-0002",
    "workflow_name": "JV-P0-CORE-event_ingest-v1",
    "workflow_version": "1.0.0"
  }
}
