{
  "schema_version": "1.0.0",
  "action_id": "act_01JBQ8Z4K7M3N9P2R5T6V8W0Z8",
  "context_id": "arbeitgeber_visolva",
  "goal": "Rueckmeldung zur Lieferzeit bis 02.09.2026 geben",
  "action_type": "task.create",
  "origin": {
    "event_id": "evt_01JBQ8Z4K7M3N9P2R5T6V8W0Y2",
    "trigger": "event",
    "source_refs": [
      {
        "object_type": "email",
        "object_id": "eml_01JBQ8Z4K7M3N9P2R5T6V8W0Z4",
        "context_id": "arbeitgeber_visolva"
      }
    ]
  },
  "actor": "jarvis",
  "target": {
    "system_adapter_id": "tasks_internal",
    "tool_id": "tasks_internal.create_task",
    "tool_version": "1.0.0",
    "target_object": {
      "object_type": "task",
      "context_id": "arbeitgeber_visolva",
      "system": "tasks_internal",
      "external_id": "case:visolva/angebot/2026-0815"
    },
    "recipients": []
  },
  "inputs": {
    "title": "Rueckmeldung zur Lieferzeit bis 02.09.2026 geben",
    "due_at": "2026-09-01T12:00:00Z",
    "priority": "high"
  },
  "missing_inputs": [],
  "risk_class": "A",
  "risk_rationale": "Interne Aufgabe ohne Aussenwirkung, jederzeit loeschbar.",
  "risk_class_source": "tool_default",
  "reversibility": "reversible",
  "approval_status": "not_required",
  "status": "planned",
  "dry_run": false,
  "priority": "high",
  "due_at": "2026-09-01T12:00:00Z",
  "idempotency_key": "16d2d42e16c0aac41b22df743297109c3b65dddbba41c1c7766c93ec8bf65760",
  "idempotency_basis": {
    "context_id": "arbeitgeber_visolva",
    "source_ref": "evt_01JBQ8Z4K7M3N9P2R5T6V8W0Y2",
    "action_type": "task.create",
    "target_system": "tasks_internal",
    "target_object_ref": "case:visolva/angebot/2026-0815"
  },
  "attempt_count": 0,
  "max_attempts": 3,
  "evidence_ids": [],
  "error_ids": [],
  "created_at": "2026-08-29T07:12:00Z",
  "producer": {
    "producer_type": "agent",
    "producer_id": "action_planner",
    "producer_version": "1.0.0"
  },
  "trace": {
    "trace_id": "tr-20260829-0002",
    "correlation_id": "co-20260829-0002",
    "workflow_name": "JV-P0-CORE-event_ingest-v1",
    "workflow_version": "1.0.0"
  }
}
